{
  "$id": "https://acs.rexkirshner.com/schemas/audit-report.json",
  "$schema": "http://json-schema.org/draft-07/schema#",
  "schemaVersion": "1.0.0",
  "title": "AuditReport",
  "description": "Complete code review audit report",
  "type": "object",
  "required": ["metadata", "summary", "findings"],
  "properties": {
    "metadata": {
      "type": "object",
      "properties": {
        "schemaVersion": {
          "type": "string",
          "pattern": "^[0-9]+\\.[0-9]+\\.[0-9]+$",
          "description": "Version of the AuditReport schema"
        },
        "timestamp": {
          "type": "string",
          "format": "date-time",
          "description": "When the audit was performed"
        },
        "acsVersion": {
          "type": "string",
          "pattern": "^[0-9]+\\.[0-9]+\\.[0-9]+$",
          "description": "Version of ACS used"
        },
        "projectName": {
          "type": "string",
          "description": "Name of the project being audited"
        },
        "agentsRun": {
          "type": "array",
          "items": {
            "type": "string"
          },
          "description": "List of review agents that were run"
        },
        "agentsSkipped": {
          "type": "array",
          "items": {
            "type": "object",
            "required": ["agent", "reason"],
            "properties": {
              "agent": {
                "type": "string",
                "description": "ID of the agent that was skipped"
              },
              "reason": {
                "type": "string",
                "description": "Reason the agent was skipped (e.g., invalid contract, not applicable)"
              }
            },
            "additionalProperties": false
          },
          "description": "List of agents that were discovered but skipped, with reasons"
        },
        "filesScanned": {
          "type": "integer",
          "minimum": 0,
          "description": "Number of files scanned"
        },
        "cacheHit": {
          "type": "boolean",
          "description": "Whether codebase context cache was used"
        }
      },
      "additionalProperties": false,
      "description": "Metadata about the audit run"
    },
    "summary": {
      "type": "object",
      "properties": {
        "grade": {
          "type": "string",
          "pattern": "^[A-F][+-]?$",
          "description": "Overall grade (A+ to F)",
          "examples": ["A", "B+", "C-", "F"]
        },
        "criticalCount": {
          "type": "integer",
          "minimum": 0,
          "description": "Number of critical severity findings"
        },
        "highCount": {
          "type": "integer",
          "minimum": 0,
          "description": "Number of high severity findings"
        },
        "mediumCount": {
          "type": "integer",
          "minimum": 0,
          "description": "Number of medium severity findings"
        },
        "lowCount": {
          "type": "integer",
          "minimum": 0,
          "description": "Number of low severity findings"
        }
      },
      "additionalProperties": false,
      "description": "Summary statistics of the audit"
    },
    "findings": {
      "type": "array",
      "items": {
        "$ref": "audit-finding.json"
      },
      "description": "List of all findings"
    },
    "positives": {
      "type": "array",
      "items": {
        "type": "string"
      },
      "description": "Positive observations about the codebase"
    },
    "groups": {
      "type": "array",
      "items": {
        "type": "object",
        "required": ["id", "type", "pattern", "count", "memberIds"],
        "properties": {
          "id": {
            "type": "string",
            "pattern": "^GROUP-[A-Z]+-[0-9]+$",
            "description": "Group identifier (e.g., GROUP-SECURITY-0)"
          },
          "type": {
            "type": "string",
            "const": "group",
            "description": "Type indicator for group entries"
          },
          "category": {
            "type": "string",
            "description": "Category of the grouped findings"
          },
          "pattern": {
            "type": "string",
            "description": "Common pattern description"
          },
          "count": {
            "type": "integer",
            "minimum": 1,
            "description": "Number of findings in this group"
          },
          "files": {
            "type": "array",
            "items": {
              "type": "string"
            },
            "description": "Files affected by this pattern"
          },
          "memberIds": {
            "type": "array",
            "items": {
              "type": "string"
            },
            "description": "IDs of findings in this group"
          }
        },
        "additionalProperties": false
      },
      "description": "Groups of similar findings (pattern-based grouping)"
    },
    "stats": {
      "type": "object",
      "properties": {
        "rawFindings": {
          "type": "integer",
          "minimum": 0,
          "description": "Total raw findings before deduplication"
        },
        "afterLocationDedup": {
          "type": "integer",
          "minimum": 0,
          "description": "Findings after location-based deduplication"
        },
        "afterPatternGrouping": {
          "type": "integer",
          "minimum": 0,
          "description": "Findings after pattern-based grouping"
        },
        "reductionPercent": {
          "type": "integer",
          "minimum": 0,
          "maximum": 100,
          "description": "Percentage reduction from deduplication"
        }
      },
      "additionalProperties": false,
      "description": "Deduplication statistics"
    }
  },
  "additionalProperties": false
}
